{
  "id": "pass.pronouns.p01",
  "title": "My New Classroom",
  "topic": "pronouns",
  "text": "Hi! I am Ben. This is my classroom. He is Tom, my classmate. She is Ella, my friend. We are all classmates together. They are very kind to me. Look at that cat. It is orange. It likes to sleep in the classroom. You can visit us anytime! I am happy here every day.",
  "sentence_ids": [],
  "vocab_ids": [
    "voc.pronouns.001",
    "voc.pronouns.003",
    "voc.pronouns.004",
    "voc.pronouns.005",
    "voc.pronouns.006",
    "voc.pronouns.007",
    "voc.pronouns.002"
  ],
  "questions": [
    {
      "id": "pass.pronouns.p01.q1",
      "question": "Who is Ben's classmate?",
      "options": [
        "Tom",
        "Ella",
        "Amy",
        "Lily"
      ],
      "answer": "Tom",
      "type": "single_choice",
      "source_sentence": "He is Tom, my classmate."
    },
    {
      "id": "pass.pronouns.p01.q2",
      "question": "What color is the cat?",
      "options": [
        "Orange",
        "Black",
        "White",
        "Brown"
      ],
      "answer": "Orange",
      "type": "single_choice",
      "source_sentence": "It is orange."
    },
    {
      "id": "pass.pronouns.p01.q3",
      "question": "How do the classmates treat Ben?",
      "options": [
        "Very kind",
        "Very shy",
        "Very tired",
        "Very busy"
      ],
      "answer": "Very kind",
      "type": "single_choice",
      "source_sentence": "They are very kind to me."
    }
  ],
  "status": "published"
}
